{
  "$schema": "https://json-schema.org/draft/2020-12/schema",
  "$id": "https://designlab.local/schemas/repl.ui.schema.json",
  "title": "Agentic REPL UI Schema",
  "type": "object",
  "required": ["version", "screens"],
  "properties": {
    "$schema": { "type": "string" },
    "version": { "type": "string", "minLength": 1 },
    "dsVersion": { "type": "string" },
    "theme": { "type": "string" },
    "screens": {
      "type": "array",
      "minItems": 1,
      "items": { "$ref": "#/$defs/uiElement" }
    },
    "tokenOverrides": {
      "type": "object",
      "additionalProperties": { "type": "string" },
      "description": "Object-level semantic token overrides. Keys are token paths (e.g., 'billing.subscription.status.active'), values are CSS variable references (e.g., 'var(--semantic-success)')."
    },
    "objectSchema": {
      "type": "object",
      "additionalProperties": { "$ref": "#/$defs/fieldSchemaEntry" },
      "description": "Object field schema for codegen. Maps field names to type metadata from composed object traits."
    }
  },
  "additionalProperties": false,
  "$defs": {
    "fieldSchemaEntry": {
      "type": "object",
      "required": ["type", "required"],
      "properties": {
        "type": { "type": "string", "description": "Field data type (string, integer, number, boolean, datetime, email, etc.)." },
        "required": { "type": "boolean", "description": "Whether the field is required." },
        "description": { "type": "string", "description": "Human-readable field description." },
        "enum": {
          "type": "array",
          "items": { "type": "string" },
          "description": "Allowed values for enum-constrained fields."
        },
        "semanticType": { "type": "string", "description": "Semantic type from the object's semantic mapping (e.g., 'billing.subscription.status')." }
      },
      "additionalProperties": false
    },
    "layout": {
      "type": "object",
      "properties": {
        "type": { "type": "string", "enum": ["stack", "grid", "inline", "section", "sidebar"] },
        "align": { "type": "string", "enum": ["start", "center", "end", "space-between"] },
        "gapToken": { "type": "string" }
      },
      "additionalProperties": false
    },
    "style": {
      "type": "object",
      "properties": {
        "spacingToken": { "type": "string" },
        "radiusToken": { "type": "string" },
        "shadowToken": { "type": "string" },
        "colorToken": { "type": "string" },
        "typographyToken": { "type": "string" }
      },
      "additionalProperties": true
    },
    "meta": {
      "type": "object",
      "properties": {
        "label": { "type": "string" },
        "intent": { "type": "string" },
        "notes": { "type": "string" },
        "confidence": { "type": "number", "minimum": 0, "maximum": 1 },
        "confidenceLevel": { "type": "string", "enum": ["high", "medium", "low"] }
      },
      "additionalProperties": false
    },
    "bindings": {
      "type": "object",
      "additionalProperties": { "type": "string" }
    },
    "props": {
      "type": "object",
      "additionalProperties": true
    },
    "uiElement": {
      "type": "object",
      "required": ["id", "component"],
      "properties": {
        "id": { "type": "string", "minLength": 1 },
        "component": { "type": "string", "minLength": 1 },
        "route": { "type": "string" },
        "layout": { "$ref": "#/$defs/layout" },
        "style": { "$ref": "#/$defs/style" },
        "props": { "$ref": "#/$defs/props" },
        "bindings": { "$ref": "#/$defs/bindings" },
        "children": {
          "type": "array",
          "items": { "$ref": "#/$defs/uiElement" }
        },
        "meta": { "$ref": "#/$defs/meta" }
      },
      "additionalProperties": false
    }
  }
}
